{
  "schema": "tkeir.ingest.manifest.v1",
  "ingest_id": "01KY4KWT5KDT6TM8VT371E084S",
  "correlation_id": "ec1ccd3bd49f844ea5cf14833b6f99ab",
  "doc_id": "67ed07fef26002119ed9c45963a80998a3200b9f1ce7aecce16f3240c5ef2f20",
  "source": {
    "uri": "upload://01KY4KWT5K9T9HP7VYFA3Z4VX7/invoice_summary_00096_0dc4aa10.docx",
    "filename": "invoice_summary_00096_0dc4aa10.docx",
    "content_type": "application/octet-stream",
    "size_bytes": 935
  },
  "pipeline_config_sha256": "62b9b357c8c77f338381992cf6d2c68ce05c027c5268f9bd2f00f373fe686eaf",
  "embedder": {
    "model": "bge-m3",
    "provider": "ollama",
    "sha256": "2688a3848238909d55190a59ea0d7e2544b8f9f6e12f4396cb7d1b59b0d0abc6"
  },
  "lineage": {},
  "status": "indexed",
  "chunk_count": 1,
  "indexed_at": "2026-07-22T09:53:16.933Z",
  "created_at": "2026-07-22T09:53:16.470Z"
}
