{
  "schema": "tkeir.ingest.manifest.v1",
  "ingest_id": "01KY4G2DFB8V2CF7SYB8VXYEPA",
  "correlation_id": "34cb28872c7bd45c9ef8aa89cceec346",
  "doc_id": "3439717d65628fc9120c782a9420ceb181cb51bc785050bbf97a88ef22bd2257",
  "source": {
    "uri": "upload://01KY4G2DFBMBETCQW6JV9S6JWY/ENTITY_00092_4882d73c.md",
    "filename": "ENTITY_00092_4882d73c.md",
    "content_type": "application/octet-stream",
    "size_bytes": 313
  },
  "pipeline_config_sha256": "62b9b357c8c77f338381992cf6d2c68ce05c027c5268f9bd2f00f373fe686eaf",
  "embedder": {
    "model": "bge-m3",
    "provider": "ollama",
    "sha256": "2688a3848238909d55190a59ea0d7e2544b8f9f6e12f4396cb7d1b59b0d0abc6"
  },
  "lineage": {},
  "status": "indexed",
  "chunk_count": 1,
  "indexed_at": "2026-07-22T08:46:26.364Z",
  "created_at": "2026-07-22T08:46:25.774Z"
}
