{
  "schema": "tkeir.ingest.manifest.v1",
  "ingest_id": "01KY4JZBRKN8814RX1Q8SEW3AY",
  "correlation_id": "e9588ee9a133a5419e732f950a2b95a6",
  "doc_id": "75ef946fb463ed9c946288e802142cafe1edf0b3baf6438b1e884b520d4e8c2d",
  "source": {
    "uri": "upload://01KY4JZBRJ6B23QM2KG85G78T5/OPORD_01110_87dec2ea.txt",
    "filename": "OPORD_01110_87dec2ea.txt",
    "content_type": "application/octet-stream",
    "size_bytes": 338
  },
  "pipeline_config_sha256": "62b9b357c8c77f338381992cf6d2c68ce05c027c5268f9bd2f00f373fe686eaf",
  "embedder": {
    "model": "bge-m3",
    "provider": "ollama",
    "sha256": "2688a3848238909d55190a59ea0d7e2544b8f9f6e12f4396cb7d1b59b0d0abc6"
  },
  "lineage": {},
  "status": "indexed",
  "chunk_count": 1,
  "indexed_at": "2026-07-22T09:37:12.593Z",
  "created_at": "2026-07-22T09:37:11.448Z"
}
