{
  "schema": "tkeir.ingest.manifest.v1",
  "ingest_id": "01KY4HMD2Z4PSQVGE1JQKNMQ7J",
  "correlation_id": "ce290754c5c19752eedd25fd24a2a8a9",
  "doc_id": "da555dae87ea2e7f77a2d09762426770062dd8d6f27fd9da4a1b0279820ca7f5",
  "source": {
    "uri": "upload://01KY4HMD2XMSNGD7WGTQ7GGSZ4/OPORD_00424_63dba8c8.json",
    "filename": "OPORD_00424_63dba8c8.json",
    "content_type": "application/octet-stream",
    "size_bytes": 469
  },
  "pipeline_config_sha256": "62b9b357c8c77f338381992cf6d2c68ce05c027c5268f9bd2f00f373fe686eaf",
  "embedder": {
    "model": "bge-m3",
    "provider": "ollama",
    "sha256": "2688a3848238909d55190a59ea0d7e2544b8f9f6e12f4396cb7d1b59b0d0abc6"
  },
  "lineage": {},
  "status": "indexed",
  "chunk_count": 1,
  "indexed_at": "2026-07-22T09:13:44.735Z",
  "created_at": "2026-07-22T09:13:43.780Z"
}
