{
  "schema": "tkeir.ingest.manifest.v1",
  "ingest_id": "01KY4KYYD63F4V4GDW1VSA3TZY",
  "correlation_id": "ebbffac337e65a57379f3c9a8ee62fb6",
  "doc_id": "a48eaee0e23676c36043168d305b6fe14e2ada2a5cd1dff1cf1ec6d354d3af5b",
  "source": {
    "uri": "upload://01KY4KYYD5MYEQZPZ7WRH15R5Z/email_thread_00143_0a524e33.txt",
    "filename": "email_thread_00143_0a524e33.txt",
    "content_type": "application/octet-stream",
    "size_bytes": 319
  },
  "pipeline_config_sha256": "62b9b357c8c77f338381992cf6d2c68ce05c027c5268f9bd2f00f373fe686eaf",
  "embedder": {
    "model": "bge-m3",
    "provider": "ollama",
    "sha256": "2688a3848238909d55190a59ea0d7e2544b8f9f6e12f4396cb7d1b59b0d0abc6"
  },
  "lineage": {},
  "status": "indexed",
  "chunk_count": 1,
  "indexed_at": "2026-07-22T09:54:27.039Z",
  "created_at": "2026-07-22T09:54:26.346Z"
}
