{
  "schema": "tkeir.ingest.manifest.v1",
  "ingest_id": "01KY4K9K46QWT873AGJ3SVPX3A",
  "correlation_id": "55589e774d657f80109d37f524e02a1e",
  "doc_id": "f7158dbcda488cc8a8bf9b1fa6483273fb5e8528a28f9d86ec1854b7a59f7296",
  "source": {
    "uri": "upload://01KY4K9K45PSTJ7GHASHTM1TP5/ADSB_01273_4236fb0e.json",
    "filename": "ADSB_01273_4236fb0e.json",
    "content_type": "application/octet-stream",
    "size_bytes": 428
  },
  "pipeline_config_sha256": "62b9b357c8c77f338381992cf6d2c68ce05c027c5268f9bd2f00f373fe686eaf",
  "embedder": {
    "model": "bge-m3",
    "provider": "ollama",
    "sha256": "2688a3848238909d55190a59ea0d7e2544b8f9f6e12f4396cb7d1b59b0d0abc6"
  },
  "lineage": {},
  "status": "indexed",
  "chunk_count": 1,
  "indexed_at": "2026-07-22T09:42:47.351Z",
  "created_at": "2026-07-22T09:42:46.667Z"
}
