{
  "schema": "tkeir.ingest.manifest.v1",
  "ingest_id": "01KY4K5CGFR8NFYMX6PNZAE9HK",
  "correlation_id": "52d28379383a046a258245d06471804c",
  "doc_id": "e8fa715ef2a421526d0f597e3e5b77c9129bd588395b943aa3ee511acc047888",
  "source": {
    "uri": "upload://01KY4K5CGDFP0Z4P47R7DVRP3X/LOGSIT_01206_cf6d28c3.md",
    "filename": "LOGSIT_01206_cf6d28c3.md",
    "content_type": "application/octet-stream",
    "size_bytes": 297
  },
  "pipeline_config_sha256": "62b9b357c8c77f338381992cf6d2c68ce05c027c5268f9bd2f00f373fe686eaf",
  "embedder": {
    "model": "bge-m3",
    "provider": "ollama",
    "sha256": "2688a3848238909d55190a59ea0d7e2544b8f9f6e12f4396cb7d1b59b0d0abc6"
  },
  "lineage": {},
  "status": "indexed",
  "chunk_count": 1,
  "indexed_at": "2026-07-22T09:40:29.594Z",
  "created_at": "2026-07-22T09:40:28.819Z"
}
