{
  "schema": "tkeir.ingest.manifest.v1",
  "ingest_id": "01KY4J9R36BB4W64MRRZWF7762",
  "correlation_id": "d645d2701ee609e81bc8f83e67389254",
  "doc_id": "fbf4870c1113818fc9d3dfd3255eb8f860e21a4700d3558f45aa03461e5dd2e8",
  "source": {
    "uri": "upload://01KY4J9R35S1F436A2QGHEXQF9/SITREP_00765_234189c5.txt",
    "filename": "SITREP_00765_234189c5.txt",
    "content_type": "application/octet-stream",
    "size_bytes": 340
  },
  "pipeline_config_sha256": "62b9b357c8c77f338381992cf6d2c68ce05c027c5268f9bd2f00f373fe686eaf",
  "embedder": {
    "model": "bge-m3",
    "provider": "ollama",
    "sha256": "2688a3848238909d55190a59ea0d7e2544b8f9f6e12f4396cb7d1b59b0d0abc6"
  },
  "lineage": {},
  "status": "indexed",
  "chunk_count": 1,
  "indexed_at": "2026-07-22T09:25:24.033Z",
  "created_at": "2026-07-22T09:25:23.179Z"
}
