{
  "schema": "tkeir.ingest.manifest.v1",
  "ingest_id": "01KY4PN1S1R30C5N5CV21MH4Z5",
  "correlation_id": "6897a76e3004d7f6079f899899db4c63",
  "doc_id": "1ace0dd986418ecd4bfbc10c90eccbb4eaa8e17e95363c11c47eb64d3b887af2",
  "source": {
    "uri": "upload://01KY4PN1S1X51C70MQQXGD3C2F/confluence_00393_dsid_d93aed75845e4a0b8126a80d8a7a5a41__c.txt",
    "filename": "confluence_00393_dsid_d93aed75845e4a0b8126a80d8a7a5a41__c.txt",
    "content_type": "application/octet-stream",
    "size_bytes": 5197
  },
  "pipeline_config_sha256": "62b9b357c8c77f338381992cf6d2c68ce05c027c5268f9bd2f00f373fe686eaf",
  "embedder": {
    "model": "bge-m3",
    "provider": "ollama",
    "sha256": "2688a3848238909d55190a59ea0d7e2544b8f9f6e12f4396cb7d1b59b0d0abc6"
  },
  "lineage": {},
  "status": "indexed",
  "chunk_count": 4,
  "indexed_at": "2026-07-22T10:41:30.610Z",
  "created_at": "2026-07-22T10:41:27.848Z"
}
