{
  "schema": "tkeir.ingest.manifest.v1",
  "ingest_id": "01KY4MX70DHJM2MQHB5EXE4PRF",
  "correlation_id": "e9bbf09107004bdbfca8675dd4b0e419",
  "doc_id": "ac076b3e96f09de9e2d925c7e453aff95e597e40636e1b59093801e3a9235086",
  "source": {
    "uri": "upload://01KY4MX70D31JPG76J8VTCRRB4/confluence_00094_dsid_a4409d6fe6ad488098e7140f79ba7452__m.txt",
    "filename": "confluence_00094_dsid_a4409d6fe6ad488098e7140f79ba7452__m.txt",
    "content_type": "application/octet-stream",
    "size_bytes": 9004
  },
  "pipeline_config_sha256": "62b9b357c8c77f338381992cf6d2c68ce05c027c5268f9bd2f00f373fe686eaf",
  "embedder": {
    "model": "bge-m3",
    "provider": "ollama",
    "sha256": "2688a3848238909d55190a59ea0d7e2544b8f9f6e12f4396cb7d1b59b0d0abc6"
  },
  "lineage": {},
  "status": "indexed",
  "chunk_count": 5,
  "indexed_at": "2026-07-22T10:11:01.984Z",
  "created_at": "2026-07-22T10:10:58.196Z"
}
