{
  "schema": "tkeir.ingest.manifest.v1",
  "ingest_id": "01KY4Q2PXJ95ZTCCDNJKGD8WWD",
  "correlation_id": "062298b13726b583202067f94e3e16b6",
  "doc_id": "af3d3513f61bd8fc658f66dd2b85f7ef3600eb10aed6e62e8a60a0d7cb8114ca",
  "source": {
    "uri": "upload://01KY4Q2PXJP5JHY5AT7Q56NVJM/confluence_00468_dsid_55a170818d7f48ca90f565bcdbaae5c9__i.txt",
    "filename": "confluence_00468_dsid_55a170818d7f48ca90f565bcdbaae5c9__i.txt",
    "content_type": "application/octet-stream",
    "size_bytes": 7557
  },
  "pipeline_config_sha256": "62b9b357c8c77f338381992cf6d2c68ce05c027c5268f9bd2f00f373fe686eaf",
  "embedder": {
    "model": "bge-m3",
    "provider": "ollama",
    "sha256": "2688a3848238909d55190a59ea0d7e2544b8f9f6e12f4396cb7d1b59b0d0abc6"
  },
  "lineage": {},
  "status": "indexed",
  "chunk_count": 5,
  "indexed_at": "2026-07-22T10:48:59.375Z",
  "created_at": "2026-07-22T10:48:55.480Z"
}
