{
  "schema": "tkeir.ingest.manifest.v1",
  "ingest_id": "01KY4HH50KKA4BV59NYNWNY4SM",
  "correlation_id": "ced22640d623f3398a96d47c0de2dc8a",
  "doc_id": "774e716f35161c639a4b364fffec15aea0229f2bf77b435425bc4c571f08976c",
  "source": {
    "uri": "upload://01KY4HH50HAMJDY0FE5QYY4NKY/AIS_00372_3360d115.txt",
    "filename": "AIS_00372_3360d115.txt",
    "content_type": "application/octet-stream",
    "size_bytes": 274
  },
  "pipeline_config_sha256": "62b9b357c8c77f338381992cf6d2c68ce05c027c5268f9bd2f00f373fe686eaf",
  "embedder": {
    "model": "bge-m3",
    "provider": "ollama",
    "sha256": "2688a3848238909d55190a59ea0d7e2544b8f9f6e12f4396cb7d1b59b0d0abc6"
  },
  "lineage": {},
  "status": "indexed",
  "chunk_count": 1,
  "indexed_at": "2026-07-22T09:11:57.856Z",
  "created_at": "2026-07-22T09:11:57.206Z"
}
