{
  "schema": "tkeir.ingest.manifest.v1",
  "ingest_id": "01KY4PK4DJ5DCA6WBR3VG9JCZJ",
  "correlation_id": "d5d7eacee4f26bd2bf9041eaba29d9d7",
  "doc_id": "986c45787d51c81fb5a32333e232aea40ac834de376bbda5fe9ad29fb7e4274a",
  "source": {
    "uri": "upload://01KY4PK4DJTGZ2WDNH81B2K0CZ/confluence_00383_dsid_2f9c99fc8ec74495b4b08c49a6083ba8__d.txt",
    "filename": "confluence_00383_dsid_2f9c99fc8ec74495b4b08c49a6083ba8__d.txt",
    "content_type": "application/octet-stream",
    "size_bytes": 10167
  },
  "pipeline_config_sha256": "62b9b357c8c77f338381992cf6d2c68ce05c027c5268f9bd2f00f373fe686eaf",
  "embedder": {
    "model": "bge-m3",
    "provider": "ollama",
    "sha256": "2688a3848238909d55190a59ea0d7e2544b8f9f6e12f4396cb7d1b59b0d0abc6"
  },
  "lineage": {},
  "status": "indexed",
  "chunk_count": 8,
  "indexed_at": "2026-07-22T10:40:30.623Z",
  "created_at": "2026-07-22T10:40:25.018Z"
}
