{
  "schema": "tkeir.ingest.manifest.v1",
  "ingest_id": "01KY4P2G9TCHMGJ3PKRXA3WWNQ",
  "correlation_id": "73218680d8fda6d2e9ed7e5d882a4925",
  "doc_id": "22d0378630ad70543dad37034054cc90683024dda0220f94552a1906d320da60",
  "source": {
    "uri": "upload://01KY4P2G9TGFVJZ1QPCX97SH5Y/confluence_00293_dsid_2f06a42b8a4c41da863601a9a7c17b5b__o.txt",
    "filename": "confluence_00293_dsid_2f06a42b8a4c41da863601a9a7c17b5b__o.txt",
    "content_type": "application/octet-stream",
    "size_bytes": 11185
  },
  "pipeline_config_sha256": "62b9b357c8c77f338381992cf6d2c68ce05c027c5268f9bd2f00f373fe686eaf",
  "embedder": {
    "model": "bge-m3",
    "provider": "ollama",
    "sha256": "2688a3848238909d55190a59ea0d7e2544b8f9f6e12f4396cb7d1b59b0d0abc6"
  },
  "lineage": {},
  "status": "indexed",
  "chunk_count": 8,
  "indexed_at": "2026-07-22T10:31:26.195Z",
  "created_at": "2026-07-22T10:31:20.130Z"
}
