{
  "schema": "tkeir.ingest.manifest.v1",
  "ingest_id": "01KY4M6F631R335VAKQRYBC2RW",
  "correlation_id": "5d862d4e46260563989672d251a72d4f",
  "doc_id": "aaf600aa0b471af80999bc7b82b7250b79b8b8331a2ba7fb518d1082dc753200",
  "source": {
    "uri": "upload://01KY4M6F62FKKAX43F6J42PM88/email_thread_00326_a33f06f4.md",
    "filename": "email_thread_00326_a33f06f4.md",
    "content_type": "application/octet-stream",
    "size_bytes": 284
  },
  "pipeline_config_sha256": "62b9b357c8c77f338381992cf6d2c68ce05c027c5268f9bd2f00f373fe686eaf",
  "embedder": {
    "model": "bge-m3",
    "provider": "ollama",
    "sha256": "2688a3848238909d55190a59ea0d7e2544b8f9f6e12f4396cb7d1b59b0d0abc6"
  },
  "lineage": {},
  "status": "indexed",
  "chunk_count": 1,
  "indexed_at": "2026-07-22T09:58:33.563Z",
  "created_at": "2026-07-22T09:58:32.904Z"
}
