{
  "schema": "tkeir.ingest.manifest.v1",
  "ingest_id": "01KY4JE4ADS2VWECZTGZTQDWZ2",
  "correlation_id": "8e4227d8cff3d101fd302223d59a17a4",
  "doc_id": "cb3a059ca309b48026af5b17143f51262f312d01c6d12a50b6fb104a3988ae5b",
  "source": {
    "uri": "upload://01KY4JE4AC335JJTQ5M2ZNWNYT/SALUTE_00835_2b5457b7.txt",
    "filename": "SALUTE_00835_2b5457b7.txt",
    "content_type": "application/octet-stream",
    "size_bytes": 266
  },
  "pipeline_config_sha256": "62b9b357c8c77f338381992cf6d2c68ce05c027c5268f9bd2f00f373fe686eaf",
  "embedder": {
    "model": "bge-m3",
    "provider": "ollama",
    "sha256": "2688a3848238909d55190a59ea0d7e2544b8f9f6e12f4396cb7d1b59b0d0abc6"
  },
  "lineage": {},
  "status": "indexed",
  "chunk_count": 1,
  "indexed_at": "2026-07-22T09:27:47.432Z",
  "created_at": "2026-07-22T09:27:46.770Z"
}
