{
  "schema": "tkeir.ingest.manifest.v1",
  "ingest_id": "01KY4JFMD91WC6HVPYPDP692KT",
  "correlation_id": "f820b2763fb4fdbaa4602b71b9b2fc2d",
  "doc_id": "9fe97a70c5cee6f58f2da0b7a36b21b8ddc9490b80ef1dd538a350bb4af8b518",
  "source": {
    "uri": "upload://01KY4JFMD7DTYJ4Z2P6Q6H1CPF/ENTITY_00859_80f6c26c.json",
    "filename": "ENTITY_00859_80f6c26c.json",
    "content_type": "application/octet-stream",
    "size_bytes": 371
  },
  "pipeline_config_sha256": "62b9b357c8c77f338381992cf6d2c68ce05c027c5268f9bd2f00f373fe686eaf",
  "embedder": {
    "model": "bge-m3",
    "provider": "ollama",
    "sha256": "2688a3848238909d55190a59ea0d7e2544b8f9f6e12f4396cb7d1b59b0d0abc6"
  },
  "lineage": {},
  "status": "indexed",
  "chunk_count": 1,
  "indexed_at": "2026-07-22T09:28:36.656Z",
  "created_at": "2026-07-22T09:28:36.013Z"
}
