{
  "schema": "tkeir.ingest.manifest.v1",
  "ingest_id": "01KY4PQMV8YJ63N461ZEY8H2Z5",
  "correlation_id": "1ac5422d50ed8d04745b4eef25f82911",
  "doc_id": "74e1041e516352956149d3c938d47fb7ccb6ee12c3ae15315ddc73bc2680063d",
  "source": {
    "uri": "upload://01KY4PQMV8TBAPYXR48333GERT/confluence_00407_dsid_0eef3b482a54451eb3587850b6a5818d__r.txt",
    "filename": "confluence_00407_dsid_0eef3b482a54451eb3587850b6a5818d__r.txt",
    "content_type": "application/octet-stream",
    "size_bytes": 9341
  },
  "pipeline_config_sha256": "62b9b357c8c77f338381992cf6d2c68ce05c027c5268f9bd2f00f373fe686eaf",
  "embedder": {
    "model": "bge-m3",
    "provider": "ollama",
    "sha256": "2688a3848238909d55190a59ea0d7e2544b8f9f6e12f4396cb7d1b59b0d0abc6"
  },
  "lineage": {},
  "status": "indexed",
  "chunk_count": 6,
  "indexed_at": "2026-07-22T10:42:57.134Z",
  "created_at": "2026-07-22T10:42:52.909Z"
}
