{
  "schema": "tkeir.ingest.manifest.v1",
  "ingest_id": "01KY4JPMR3VZVREX9QA0NAQ16C",
  "correlation_id": "13be1e71566dd9fb4ccf178f5521659e",
  "doc_id": "b213ad0d630baffcd5fa844c27efa5c705cd6e25d0b201f3d60317598dd6af8c",
  "source": {
    "uri": "upload://01KY4JPMR1T2SSPNV9RVEY2RA4/OPORD_00971_a4a8a844.pdf",
    "filename": "OPORD_00971_a4a8a844.pdf",
    "content_type": "application/octet-stream",
    "size_bytes": 979
  },
  "pipeline_config_sha256": "62b9b357c8c77f338381992cf6d2c68ce05c027c5268f9bd2f00f373fe686eaf",
  "embedder": {
    "model": "bge-m3",
    "provider": "ollama",
    "sha256": "2688a3848238909d55190a59ea0d7e2544b8f9f6e12f4396cb7d1b59b0d0abc6"
  },
  "lineage": {},
  "status": "indexed",
  "chunk_count": 1,
  "indexed_at": "2026-07-22T09:32:26.708Z",
  "created_at": "2026-07-22T09:32:25.736Z"
}
