{
  "schema": "tkeir.ingest.manifest.v1",
  "ingest_id": "01KY4JECBMNR08EQPP4Y4GJQBW",
  "correlation_id": "b67e18fc0ee741a713593ad8d8405933",
  "doc_id": "f20e25e7871cd6ebfc81d05a24d381b729876da0a69d4848e559d898eb7d2d2b",
  "source": {
    "uri": "upload://01KY4JECBKKZPFQE4VV49HD1QE/OPORD_00839_4bf7e012.md",
    "filename": "OPORD_00839_4bf7e012.md",
    "content_type": "application/octet-stream",
    "size_bytes": 307
  },
  "pipeline_config_sha256": "62b9b357c8c77f338381992cf6d2c68ce05c027c5268f9bd2f00f373fe686eaf",
  "embedder": {
    "model": "bge-m3",
    "provider": "ollama",
    "sha256": "2688a3848238909d55190a59ea0d7e2544b8f9f6e12f4396cb7d1b59b0d0abc6"
  },
  "lineage": {},
  "status": "indexed",
  "chunk_count": 1,
  "indexed_at": "2026-07-22T09:27:55.918Z",
  "created_at": "2026-07-22T09:27:55.000Z"
}
