{
  "schema": "tkeir.ingest.manifest.v1",
  "ingest_id": "01KY4JP2QX6FSMVCP2MZ0AF8PF",
  "correlation_id": "a908996c7da015a4738549ad05977254",
  "doc_id": "51b302cb412a6ec0cbfe4badaa6ea22e8cb28ab91c456dad3ba6eed8aee21994",
  "source": {
    "uri": "upload://01KY4JP2QV2RR47HJQ9HECBG2J/SITREP_00962_0d8f808d.csv",
    "filename": "SITREP_00962_0d8f808d.csv",
    "content_type": "application/octet-stream",
    "size_bytes": 438
  },
  "pipeline_config_sha256": "62b9b357c8c77f338381992cf6d2c68ce05c027c5268f9bd2f00f373fe686eaf",
  "embedder": {
    "model": "bge-m3",
    "provider": "ollama",
    "sha256": "2688a3848238909d55190a59ea0d7e2544b8f9f6e12f4396cb7d1b59b0d0abc6"
  },
  "lineage": {},
  "status": "indexed",
  "chunk_count": 1,
  "indexed_at": "2026-07-22T09:32:08.220Z",
  "created_at": "2026-07-22T09:32:07.298Z"
}
