{
  "schema": "tkeir.ingest.manifest.v1",
  "ingest_id": "01KY4H4RGYWZV24QJ9FJA5PZ9V",
  "correlation_id": "492992c5c22e186cea8c58ca85e647b7",
  "doc_id": "7e22e21e62392fbce61b9d4e2111ea175019c6ff4dd1d16d432b608be7e1abf6",
  "source": {
    "uri": "upload://01KY4H4RGW6NWKFPVT99RR6E4V/SITREP_00174_c8969c5b.json",
    "filename": "SITREP_00174_c8969c5b.json",
    "content_type": "application/octet-stream",
    "size_bytes": 583
  },
  "pipeline_config_sha256": "62b9b357c8c77f338381992cf6d2c68ce05c027c5268f9bd2f00f373fe686eaf",
  "embedder": {
    "model": "bge-m3",
    "provider": "ollama",
    "sha256": "2688a3848238909d55190a59ea0d7e2544b8f9f6e12f4396cb7d1b59b0d0abc6"
  },
  "lineage": {},
  "status": "indexed",
  "chunk_count": 1,
  "indexed_at": "2026-07-22T09:05:12.137Z",
  "created_at": "2026-07-22T09:05:11.200Z"
}
